{
  "schema_version": "2.0",
  "artifact_type": "report",
  "project_id": "coar-demo",
  "created_at": "2026-07-14T12:00:00Z",
  "updated_at": "2026-07-14T12:00:00Z",
  "extensions": {},
  "trial_id": "000001_test-main-signal",
  "local_question_outcome": "answered",
  "trial_outcome": "advanced",
  "summary": "The method outperformed the baseline on the scoped benchmark.",
  "work_performed": [
    "Ran baseline and method under one metric."
  ],
  "procedures": [
    {
      "description": "Run comparison",
      "command_or_method": "python workspace/eval.py",
      "result": "method=0.71 baseline=0.64"
    }
  ],
  "artifacts": [
    {
      "path": "research_trajectory/trials/000001_test-main-signal/artifacts/results.json",
      "role": "primary_result",
      "sha256": "0000000000000000000000000000000000000000000000000000000000000000",
      "extensions": {}
    }
  ],
  "deviations": [],
  "findings": [
    "A scoped positive signal exists."
  ],
  "negative_results": [],
  "limitations": [
    "One run only."
  ],
  "interpretation": "The result supports a tentative scoped claim, not broad generalization.",
  "line_effects": [
    {
      "line_id": "L0001",
      "effect": "strengthens",
      "rationale": "Adds the first direct comparison."
    }
  ],
  "campaign_effects": [
    {
      "campaign_id": "C0001",
      "component_id": "main_signal",
      "proposed_status": "tentative",
      "rationale": "One credible but unreplicated result."
    }
  ],
  "venue_impact": "No venue change.",
  "knowledge_capture": {
    "disposition": "no_note",
    "reason": "The lesson is represented by result cards and current findings.",
    "path": null
  },
  "recommended_next_moves": [
    {
      "target": "evaluation",
      "move": "test",
      "question": "Does the result replicate across seeds?",
      "expected_value": "high"
    }
  ]
}
